#;Jurisdiction;Kind;Publication Number;Lens ID;Publication Date;Publication Year;Application Number;Application Date;Priority Numbers;Earliest Priority Date;Title;Applicants;Inventors;Owners (US);Type;Cited by Patent Count;Simple Family Size;Extended Family Size;Sequence Count;CPC Classifications;IPCR Classifications;US Classifications;NPL Citation Count;NPL Resolved Citation Count
1;WO;A2;WO 2019/072308 A2;040-919-249-060-055;2019-04-18;2019;CN 2018124975 W;2018-12-28;CN 2018124975 W 20181228;2018-12-28;Improving Blockchain Transaction Speeds Using Global Acceleration Nodes;ALIBABA GROUP HOLDING LTD;XIA NING;;Patent Application;0;8;8;0;;;;0;0
2;US;A1;US 2017/0337534 A1;131-246-396-588-47X;2017-11-23;2017;US 201715476111 A;2017-03-31;"US 201715476111 A 20170331;;US 201615376375 A 20161212;;US 201562266592 P 20151212;;US 201562252097 P 20151106;;US 201662315835 P 20160331";2015-11-06;Systems And Methods For Blockchain Virtualization And Scalability;CABLE TELEVISION LABORATORIES INC;"GOERINGER STEVEN JOHN;;SCRIBER BRIAN ALEXANDER;;LUND ROBERT MICHAEL";CABLE TELEVISION LABORATORIES INC (2017-10-13);Patent Application;33;1;5;0;;"G06Q20/12;;G06Q20/06;;G06Q20/38;;G06Q20/40;;H04L9/06";;0;0
3;US;A1;US 2019/0349185 A1;151-173-804-071-332;2019-11-14;2019;US 201916253525 A;2019-01-22;KR 20180053009 A 20180509;2018-05-09;Block Generation Method In Blockchain-based System;SAMSUNG SDS CO LTD;"KIM JEONG HO;;SONG MIN KANG;;SON SEUNG WON;;KIM DOO YEOL;;KO SEUNG JUN;;SEO YEONG MIN";SAMSUNG SDS CO. LTD (2019-01-15);Patent Application;0;3;3;0;;H04L9/06;;0;0
4;US;B2;US 10552556 B2;129-077-666-504-437;2020-02-04;2020;US 201816208853 A;2018-12-04;"US 201816208853 A 20181204;;US 201816152090 A 20181004;;US 201762594519 P 20171204;;US 201762570064 P 20171009;;US 201762554546 P 20170905;;US 201762549138 P 20170823;;US 201762547227 P 20170818;;US 201762540943 P 20170803";2017-08-03;System And Method For Performance Testing Of Scalable Distributed Network Transactional Databases;LIQUINEQ AG;KIKINIS DAN;LIQUINEQ AG (2018-11-24);Granted Patent;0;2;13;0;;"G06F16/18;;G06F16/182;;H04L9/06";;2;2
5;US;B2;US 10230530 B2;013-814-051-616-345;2019-03-12;2019;US 201816052912 A;2018-08-02;US 201762541657 P 20170805;2017-08-05;Method And System For Securing A Blockchain With Proof-of-transactions;PROCLUS TECH LIMITED;"LANCASHIRE DAVID BEGOR;;PARRIS RICHARD MICHAEL";PROCLUS TECHNOLOGIES LIMITED (2018-07-28);Granted Patent;3;13;15;0;;"H04L9/32;;G06Q20/06;;G06Q20/38";;7;1
6;WO;A2;WO 2020/035086 A2;186-033-752-407-820;2020-02-20;2020;CN 2019115878 W;2019-11-06;CN 2019115878 W 20191106;2019-11-06;Data Security Of Shared Blockchain Data Storage Based On Error Correction Code;ALIPAY HANGZHOU INFORMATION TECH CO LTD;"LU ZHONGHAO;;ZHUO HAIZHEN";;Patent Application;0;1;1;0;;;;0;0
7;US;B1;US 10438290 B1;137-909-780-832-433;2019-10-08;2019;US 201815960040 A;2018-04-23;"US 201862660655 P 20180420;;US 201862647353 P 20180323;;US 201862638679 P 20180305";2018-03-05;System, Method And Program Product For Generating And Utilizing Stable Value Digital Assets;WINKLEVOSS IP LLC;"WINKLEVOSS CAMERON HOWARD;;WINKLEVOSS TYLER HOWARD";WINKLEVOSS IP LLC (2018-06-29);Granted Patent;0;1;6;0;;"G06Q40/06;;G06F16/18;;G06F16/182;;G06Q20/06;;G06Q20/10;;G06Q20/22;;H04L9/06;;H04L9/32";;200;2
8;WO;A2;WO 2020/035090 A2;023-029-359-480-615;2020-02-20;2020;CN 2019116655 W;2019-11-08;CN 2019116655 W 20191108;2019-11-08;Lightweight Decentralized Application Platform;ALIPAY HANGZHOU INFORMATION TECH CO LTD;"SUN SHANLU;;LI SHUBO";;Patent Application;0;1;1;0;;;;0;0
9;WO;A2;WO 2020/035089 A2;119-378-647-303-943;2020-02-20;2020;CN 2019116649 W;2019-11-08;CN 2019116649 W 20191108;2019-11-08;System And Method For Blockchain-based Decentralized Application Development;ALIPAY HANGZHOU INFORMATION TECH CO LTD;"SUN SHANLU;;LI SHUBO";;Patent Application;0;1;1;0;;;;0;0
10;WO;A2;WO 2019/072309 A2;140-404-624-426-104;2019-04-18;2019;CN 2018125183 W;2018-12-29;CN 2018125183 W 20181229;2018-12-29;Visual Blockchain Browser;ALIBABA GROUP HOLDING LTD;LI YANPENG;;Patent Application;0;11;11;0;;;;0;0
11;WO;A2;WO 2020/035093 A2;037-685-749-232-397;2020-02-20;2020;CN 2019118180 W;2019-11-13;CN 2019118180 W 20191113;2019-11-13;Dynamic Blockchain Data Storage Based On Error Correction Code;ALIPAY HANGZHOU INFORMATION TECH CO LTD;"ZHUO HAIZHEN;;LU ZHONGHAO";;Patent Application;0;1;1;0;;;;0;0
12;WO;A2;WO 2019/228556 A2;014-251-941-483-281;2019-12-05;2019;CN 2019103780 W;2019-08-30;"CN 2019094396 W 20190702;;CN 2019095299 W 20190709";2019-07-02;System And Method For Decentralized-identifier Creation;ALIBABA GROUP HOLDING LTD;"YANG RENHUI;;LIU JIAWEI;;CHEN YUAN;;LIN YUQI";;Patent Application;0;3;5;0;;;;0;0
13;US;B2;US 10574464 B2;077-039-649-174-390;2020-02-25;2020;US 201916249514 A;2019-01-16;US 201762541657 P 20170805;2017-08-05;Method And System For Securing A Blockchain With Proof-of-transactions;PROCLUS TECH LIMITED;"LANCASHIRE DAVID BEGOR;;PARRIS RICHARD MICHAEL";PROCLUS TECHNOLOGIES LIMITED (2018-07-28);Granted Patent;0;13;15;0;;"H04L9/32;;G06Q20/06;;G06Q20/38;;G06Q20/40";;12;1
14;US;A1;US 2019/0065709 A1;115-853-570-355-634;2019-02-28;2019;US 201815864970 A;2018-01-08;US 201762549893 P 20170824;2017-08-24;Digital Asset Traceability And Assurance Using A Distributed Ledger;ORACLE INT CORP;SALOMON ROBERTO;ORACLE INTERNATIONAL CORPORATION (2018-01-08);Patent Application;1;2;2;0;;"G06F21/16;;G06F8/40;;G06F8/71;;G06F21/57;;H04L9/06;;H04L9/32";;0;0
15;WO;A2;WO 2020/035087 A2;083-690-983-362-020;2020-02-20;2020;CN 2019115892 W;2019-11-06;CN 2019115892 W 20191106;2019-11-06;Consenus Of Shared Blockchain Data Storage Based On Error Correction Code;ALIPAY HANGZHOU INFORMATION TECH CO LTD;"LU ZHONGHAO;;ZHUO HAIZHEN";;Patent Application;0;1;1;0;;;;0;0
16;US;A1;US 2018/0089761 A1;174-059-149-058-304;2018-03-29;2018;US 201715715715 A;2017-09-26;"US 201662399763 P 20160926;;US 201762453416 P 20170201;;US 201762453350 P 20170201;;US 201762453379 P 20170201;;US 201762453384 P 20170201";2016-09-26;System And Method Of Providing A Leader-follower Multi-asset Portfolio;SHAPESHIFT AG;"STRADLING ADAM;;VOORHEES ERIK";SHAPESHIFT AG (2017-03-10);Patent Application;9;7;7;0;;"G06Q40/06;;G06F12/14;;H04L9/32";;0;0
17;WO;A1;WO 2019/040308 A1;193-701-008-066-241;2019-02-28;2019;US 2018/0046522 W;2018-08-13;US 201762549893 P 20170824;2017-08-24;Digital Asset Traceability And Assurance Using A Distributed Ledger;ORACLE INT CORP;SALOMON ROBERTO;;Patent Application;0;2;2;0;;"G06F21/64;;H04L9/32";;1;0
18;WO;A2;WO 2020/011284 A2;135-474-033-914-635;2020-01-16;2020;CN 2019109416 W;2019-09-30;CN 201910838736 A 20190905;2019-09-05;System And Method For Adding Node In Blockchain Network;ALIBABA GROUP HOLDING LTD;"XIE GUILU;;XIA NING";;Patent Application;0;2;2;0;;;;0;0
19;US;B2;US 10594488 B2;065-827-185-213-938;2020-03-17;2020;US 201916409449 A;2019-05-10;"US 201916409449 A 20190510;;US 201762541657 P 20170805";2017-08-05;Method And System For Implementing Automatic Transaction Rebroadcasting For Transient Blockchains;PROCLUS TECH LIMITED;LANCASHIRE DAVID BEGOR;PROCLUS TECHNOLOGIES LIMITED (2019-05-29);Granted Patent;0;2;15;0;;"H04L9/32;;G06Q20/06;;G06Q20/22;;G06Q20/38;;G06Q20/40";;16;1
20;US;A1;US 2018/0308072 A1;101-313-649-253-045;2018-10-25;2018;US 201715494224 A;2017-04-21;US 201715494224 A 20170421;2017-04-21;Method And Apparatus For Blockchain Management;GEM;"SMITH MATTHEW BENJAMIN;;VERGEL DE DIOS JULIAN;;HYDERABADKANNAN SIVASUBRAMANIAN;;LEDERMAN JOSHUA";GEM (2017-04-24);Patent Application;0;1;1;0;"G06Q20/0655;;G06Q20/02;;G06Q20/06;;G06Q2220/00";G06Q20/06;;0;0
21;WO;A2;WO 2020/011287 A2;028-649-404-572-156;2020-01-16;2020;CN 2019111316 W;2019-10-15;CN 2019111316 W 20191015;2019-10-15;Indexing And Recovering Encoded Blockchain Data;ALIPAY HANGZHOU INFORMATION TECH CO LTD;ZHUO HAIZHEN;;Patent Application;0;1;1;0;;;;0;0
22;WO;A2;WO 2019/228553 A2;069-203-600-115-957;2019-12-05;2019;CN 2019102891 W;2019-08-27;CN 2019102891 W 20190827;2019-08-27;System And Method For Registering Subscribable Sub-states In Blockchain;ALIBABA GROUP HOLDING LTD;"SHI RUBING;;GUAN YAYANG";;Patent Application;0;1;1;0;;;;0;0
23;WO;A2;WO 2019/228550 A2;064-919-810-524-646;2019-12-05;2019;CN 2019101575 W;2019-08-20;CN 2019101575 W 20190820;2019-08-20;Blockchain Data Storage Based On Shared Nodes And Error Correction Code;ALIBABA GROUP HOLDING LTD;ZHUO HAIZHEN;;Patent Application;0;1;1;0;;;;0;0
24;WO;A2;WO 2019/228552 A2;038-129-484-309-983;2019-12-05;2019;CN 2019102885 W;2019-08-27;CN 2019102885 W 20190827;2019-08-27;System And Method For Blockchain-based Notification;ALIBABA GROUP HOLDING LTD;"GUAN YAYANG;;SHI RUBING";;Patent Application;0;1;1;0;;;;0;0
25;WO;A2;WO 2019/101232 A2;161-881-559-598-252;2019-05-31;2019;CN 2019076873 W;2019-03-04;CN 2019076873 W 20190304;2019-03-04;Methods And Devices For Providing Transaction Data To Blockchain System For Processing;ALIBABA GROUP HOLDING LTD;"CHENG LONG;;LI YANPENG";;Patent Application;0;6;6;0;;;;0;0
26;WO;A2;WO 2019/228551 A2;053-808-419-244-624;2019-12-05;2019;CN 2019102877 W;2019-08-27;CN 2019102877 W 20190827;2019-08-27;System And Method For Registering Subscribable States In Blockchain;ALIBABA GROUP HOLDING LTD;"GUAN YAYANG;;SHI RUBING";;Patent Application;0;1;1;0;;;;0;0
27;WO;A1;WO 2019/036251 A1;091-725-411-448-862;2019-02-21;2019;US 2018/0045768 W;2018-08-08;US 201762544986 P 20170814;2017-08-14;Apparatus And Method For Using Blockchains With Secure Custody Transfer Data, Sealing Data, And Other Data Associated With Material Transfers;HONEYWELL INT INC;DE LIGT RUUD;;Patent Application;0;2;2;0;"H04L9/0637;;G06F21/602;;G06F21/64;;H04L9/321;;H04L9/3236;;H04L9/3297;;H04L2209/38";"H04L9/06;;H04L9/08";;0;0
28;WO;A2;WO 2019/101231 A2;047-261-370-348-671;2019-05-31;2019;CN 2019076866 W;2019-03-04;CN 2019076866 W 20190304;2019-03-04;Methods And Devices For Processing Certificates In Blockchain System;ALIBABA GROUP HOLDING LTD;"CHENG LONG;;LI YANPENG";;Patent Application;0;6;6;0;;;;0;0
29;WO;A2;WO 2020/035094 A2;099-441-175-186-819;2020-02-20;2020;CN 2019119375 W;2019-11-19;CN 2019119375 W 20191119;2019-11-19;System And Method For Consensus Management;ALIPAY HANGZHOU INFORMATION TECH CO LTD;"YANG WENLONG;;PENG YUJUN";;Patent Application;0;1;1;0;;;;0;0
30;WO;A1;WO 2019/113016 A1;158-466-045-638-097;2019-06-13;2019;US 2018/0063777 W;2018-12-04;"US 201816208853 A 20181204;;US 201762594519 P 20171204";2017-12-04;System And Method For Performance Testing Of Scalable Distributed Network Transactional Databases;KIKINIS DAN;KIKINIS DAN;;Patent Application;0;1;13;0;;"G06F11/30;;G06F16/27";;1;1
31;WO;A2;WO 2019/228562 A2;033-978-405-732-439;2019-12-05;2019;CN 2019105327 W;2019-09-11;CN 2019105327 W 20190911;2019-09-11;Shared Blockchain Data Storage Based On Error Correction Coding In Trusted Execution Environments;ALIBABA GROUP HOLDING LTD;ZHUO HAIZHEN;;Patent Application;0;1;1;0;;;;0;0
32;WO;A1;WO 2020/028589 A1;069-995-665-933-596;2020-02-06;2020;US 2019/0044544 W;2019-07-31;US 201862712449 P 20180731;2018-07-31;Techniques For Expediting Processing Of Blockchain Transactions;AMERICORP INVEST LLC;SIMONS JORDAN;;Patent Application;0;2;2;0;;"G06Q20/00;;G06Q20/06;;G06Q20/10;;G06Q20/36;;G06Q20/38;;G06Q20/40";;0;0
33;US;A1;US 2020/0043007 A1;016-415-611-999-737;2020-02-06;2020;US 201916528430 A;2019-07-31;US 201862712449 P 20180731;2018-07-31;Techniques For Expediting Processing Of Blockchain Transactions;AMERICORP INVEST LLC;SIMONS JORDAN;AMERICORP INVESTMENTS LLC (2019-07-31);Patent Application;0;2;2;0;;"G06Q20/40;;H04L9/32";;0;0
34;US;B1;US 10540653 B1;035-832-392-694-904;2020-01-21;2020;US 201916421975 A;2019-05-24;"US 201916293531 A 20190305;;US 201816036469 A 20180716;;US 201816020534 A 20180627;;US 201815960040 A 20180423;;US 201916282955 A 20190222;;US 201916280788 A 20190220;;US 201815973140 A 20180507;;US 201815973175 A 20180507;;US 201862728441 P 20180907;;US 201862721983 P 20180823;;US 201862764977 P 20180817;;US 201862689563 P 20180625;;US 201862683412 P 20180611;;US 201862660655 P 20180420;;US 201862647353 P 20180323;;US 201862638679 P 20180305;;US 201862684023 P 20180612;;US 201862680775 P 20180605;;US 201862702265 P 20180723;;US 201862764978 P 20180817;;US 201862732347 P 20180917;;US 201862642946 P 20180314;;US 201862642931 P 20180314;;US 201862629417 P 20180212";2018-02-12;System, Method And Program Product For Modifying A Supply Of Stable Value Digital Asset Tokens;WINKLEVOSS IP LLC;"JAMES DANIEL WILLIAM HALLEY;;WINKLEVOSS CAMERON HOWARD;;WINKLEVOSS TYLER HOWARD;;ARVANAGHI BRANDON;;WINER ERIC NEIMAN;;JUDKINS STEPHEN;;PARKINSON ALEX";WINKLEVOSS IP LLC (2019-05-30);Granted Patent;0;2;6;0;;G06Q20/38;;194;2
35;US;A1;US 2017/0116693 A1;019-649-109-876-214;2017-04-27;2017;US 201615336778 A;2016-10-27;US 201562246992 P 20151027;2015-10-27;Systems And Methods For Decentralizing Commerce And Rights Management For Digital Assets Using A Blockchain Rights Ledger;VERIMATRIX INC;"RAE CHRISTOPHER;;THORWIRTH NIELS J";;Patent Application;92;1;1;0;"G06Q50/184;;G06F21/10;;G06F21/64;;G06F2221/2107;;G06Q20/1235;;G06Q20/3827;;G06Q20/3829;;G06Q2220/00;;G06Q2220/18;;H04L9/0825;;H04L9/3236;;H04L9/3247;;H04L2209/38;;H04L2209/603;;H04N21/6334";"G06Q50/18;;G06F21/10;;G06Q20/10;;G06Q20/38;;H04L9/30;;H04L9/32";;0;0
36;US;B1;US 10373158 B1;158-234-153-875-61X;2019-08-06;2019;US 201916293531 A;2019-03-05;"US 201916293531 A 20190305;;US 201916282955 A 20190222;;US 201916280788 A 20190220;;US 201816036469 A 20180716;;US 201816020534 A 20180627;;US 201815973140 A 20180507;;US 201815973175 A 20180507;;US 201815960040 A 20180423;;US 201862732347 P 20180917;;US 201862728441 P 20180907;;US 201862721983 P 20180823;;US 201862764977 P 20180817;;US 201862764978 P 20180817;;US 201862702265 P 20180723;;US 201862689563 P 20180625;;US 201862684023 P 20180612;;US 201862683412 P 20180611;;US 201862680775 P 20180605;;US 201862660655 P 20180420;;US 201862647353 P 20180323;;US 201862642931 P 20180314;;US 201862642946 P 20180314;;US 201862638679 P 20180305;;US 201862629417 P 20180212";2018-02-12;System, Method And Program Product For Modifying A Supply Of Stable Value Digital Asset Tokens;WINKLEVOSS IP LLC;"JAMES DANIEL WILLIAM HALLEY;;WINKLEVOSS CAMERON HOWARD;;WINKLEVOSS TYLER HOWARD;;ARVANAGHI BRANDON;;WINER ERIC NEIMAN;;JUDKINS STEPHEN;;PARKINSON ALEX";WINKLEVOSS IP LLC (2019-05-30);Granted Patent;1;2;6;0;;G06Q20/38;;202;2
37;WO;A2;WO 2019/072306 A2;154-438-432-627-968;2019-04-18;2019;CN 2018124894 W;2018-12-28;CN 2018124894 W 20181228;2018-12-28;Accelerating Transaction Deliveries In Blockchain Networks Using Transaction Resending;ALIBABA GROUP HOLDING LTD;XIA NING;;Patent Application;0;7;7;0;;;;0;0
38;WO;A2;WO 2020/035088 A2;166-618-020-512-842;2020-02-20;2020;CN 2019115902 W;2019-11-06;CN 2019115902 W 20191106;2019-11-06;Prioritizing Shared Blockchain Data Storage;ALIPAY HANGZHOU INFORMATION TECH CO LTD;"LU ZHONGHAO;;ZHUO HAIZHEN";;Patent Application;0;1;1;0;;;;0;0
39;WO;A1;WO 2017/109140 A1;159-720-129-673-604;2017-06-29;2017;EP 2016082494 W;2016-12-22;"US 201562270802 P 20151222;;US 201662292521 P 20160208";2015-12-22;Decentralized, Tamper-resistant, Asset-oriented Database System And Method Of Recording A Transaction;BIGCHAINDB GMBH;"MCCONAGHY TRENT LORNE;;MARQUES RODOLPHE;;MÜLLER ANDREAS";;Patent Application;17;1;1;0;"G06F21/6218;;G06F16/27;;G06F21/64;;G06Q20/02;;G06Q20/382;;G06Q2220/00";"G06Q20/38;;G06F17/30;;G06F21/62";;4;1
40;WO;A2;WO 2019/141298 A2;160-667-588-634-394;2019-07-25;2019;CN 2019087745 W;2019-05-21;CN 2019087745 W 20190521;2019-05-21;Methods And Devices For Storing And Processing Electronic Medical Record On Blockchain;ALIBABA GROUP HOLDING LTD;"ZHANG YIXIANG;;YANG XUEQING;;LI SHUBO;;LIANG ZHIHUA";;Patent Application;0;2;2;0;;;;0;0
41;WO;A2;WO 2019/072307 A2;167-763-842-106-752;2019-04-18;2019;CN 2018124956 W;2018-12-28;CN 2018124956 W 20181228;2018-12-28;Accelerating Transaction Deliveries In Blockchain Networks Using Acceleration Nodes;ALIBABA GROUP HOLDING LTD;XIA NING;;Patent Application;0;6;6;0;;;;0;0
42;WO;A2;WO 2019/170170 A2;066-933-718-896-854;2019-09-12;2019;CN 2019092318 W;2019-06-21;CN 2019092318 W 20190621;2019-06-21;Methods And Systems For Automatic Blockchain Deployment Based On Cloud Platform;ALIBABA GROUP HOLDING LTD;ZHU MING;;Patent Application;0;1;1;0;;;;0;0
43;WO;A2;WO 2020/011283 A2;122-552-975-916-908;2020-01-16;2020;CN 2019109400 W;2019-09-30;CN 201910838733 A 20190905;2019-09-05;System And Method For Deleting Node In Blockchain Network;ALIBABA GROUP HOLDING LTD;"XIE GUILU;;XIA NING";;Patent Application;0;2;2;0;;;;0;0
44;US;A1;US 2020/0019288 A1;150-703-974-173-031;2020-01-16;2020;US 201916524019 A;2019-07-27;"US 201916524019 A 20190727;;US 201514817156 A 20150803;;US 201261733801 P 20121205;;US 201161581585 P 20111229;;US 201862711058 P 20180727";2011-12-29;Stranded Blockchain;"DAMORE BRANDON E;;THATCHER JOEL P;;PICCIONELLI GREGORY A";"D'AMORE BRANDON E;;THATCHER JOEL P;;PICCIONELLI GREGORY A";;Patent Application;0;1;15;0;;"G06F3/0484;;G06Q10/06;;G06Q10/10;;H04L29/08";;0;0
45;US;A1;US 2019/0130394 A1;148-957-621-527-410;2019-05-02;2019;US 201715488925 A;2017-04-17;US 201715488925 A 20170417;2017-04-17;Systems And Methods To Validate Transactions For Inclusion In Electronic Blockchains;"STOLLMAN JEFF;;MATEEV MARTIN";"STOLLMAN JEFF;;MATEEV MARTIN";;Patent Application;2;1;1;0;;"G06Q20/38;;G06F16/23;;H04L9/06";;0;0
46;WO;A1;WO 2018/172439 A1;073-724-517-417-338;2018-09-27;2018;EP 2018057233 W;2018-03-22;EP 17162326 A 20170322;2017-03-22;Method For Operating A Blockchain;NEC LABORATORIES EUROPE GMBH;"PUDDU IVAN;;DMITRIENKO ALEXANDRA;;KARAME GHASSAN;;CAPKUN SRDJAN";;Patent Application;1;3;3;0;;"G06Q20/02;;G06Q20/38";;2;0
47;US;A1;US 2019/0140935 A1;171-104-528-972-965;2019-05-09;2019;US 201816208853 A;2018-12-04;"US 201816208853 A 20181204;;US 201816152090 A 20181004;;US 201762594519 P 20171204;;US 201762570064 P 20171009;;US 201762554546 P 20170905;;US 201762549138 P 20170823;;US 201762547227 P 20170818;;US 201762540943 P 20170803";2017-08-03;System And Method For Performance Testing Of Scalable Distributed Network Transactional Databases;LIQUINEQ AG;KIKINIS DAN;LIQUINEQ AG (2018-11-24);Patent Application;0;2;13;0;;"H04L12/26;;G06F16/18;;G06F16/182;;G06F17/50;;H04L9/06;;H04L29/08";;0;0
48;WO;A2;WO 2019/144042 A2;011-973-828-701-844;2019-07-25;2019;US 2019/0014346 W;2019-01-18;US 201862619839 P 20180121;2018-01-21;Distributed Security Mechanism For Blockchains And Distributed Ledgers;CIPHERTRACE INC;JEVANS DAVID;;Patent Application;0;2;2;0;;H04L9/06;;0;0
49;US;A1;US 2019/0229892 A1;190-886-098-439-615;2019-07-25;2019;US 201916252209 A;2019-01-18;US 201862619839 P 20180121;2018-01-21;Distributed Security Mechanism For Blockchains And Distributed Ledgers;CIPHERTRACE INC;JEVANS DAVID;CIPHERTRACE INC (2018-10-12);Patent Application;0;2;2;0;;"H04L9/06;;H04L9/30;;H04L9/32";;0;0
50;WO;A1;WO 2019/245577 A1;046-559-579-759-354;2019-12-26;2019;US 2018/0038957 W;2018-06-22;US 2018 0038957 W 20180622;2018-06-22;Systems And Methods To Validate Transactions For Inclusion In Electronic Blockchains;STOLLMAN JEFF;STOLLMAN JEFF;;Patent Application;0;1;1;0;;H04L29/06;;0;0
51;US;B1;US 10002389 B1;111-590-544-891-225;2018-06-19;2018;US 201715822955 A;2017-11-27;"US 201461989047 P 20140506;;US 201461986685 P 20140430;;US 201461978724 P 20140411;;US 201461971981 P 20140328;;US 201461955017 P 20140318;;US 201461933428 P 20140130;;US 201361920534 P 20131224;;US 201361903245 P 20131112;;US 201361900191 P 20131105;;US 201361891294 P 20131015;;US 201361857691 P 20130723;;US 201361857141 P 20130722;;US 201361856323 P 20130719;;US 201361841760 P 20130701;;US 201361841177 P 20130628";2013-06-28;Systems, Methods, And Program Products For An Application Programming Interface Generating A Blended Digital Math-based Assets Index;WINKLEVOSS IP LLC;"WINKLEVOSS CAMERON HOWARD;;WINKLEVOSS TYLER HOWARD;;GREEBEL EVAN LOUIS;;MORIARTY KATHLEEN HILL;;XETHALIS GREGORY ELIAS";WINKLEVOSS IP LLC (2015-02-25);Granted Patent;2;6;10;0;G06Q40/04;"G06Q40/00;;G06Q40/04";;135;2
52;US;B1;US 10255635 B1;172-431-583-189-951;2019-04-09;2019;US 201815973221 A;2018-05-07;"US 201461989047 P 20140506;;US 201461986685 P 20140430;;US 201461978724 P 20140411;;US 201461971981 P 20140328;;US 201461955017 P 20140318;;US 201461933428 P 20140130;;US 201361920534 P 20131224;;US 201361903245 P 20131112;;US 201361900191 P 20131105;;US 201361891294 P 20131015;;US 201361857691 P 20130723;;US 201361857141 P 20130722;;US 201361856323 P 20130719;;US 201361841760 P 20130701;;US 201361841177 P 20130628";2013-06-28;Systems, Methods, And Program Products For An Application Programming Interface Generating A Blended Digital Math-based Assets Index;WINKLEVOSS IP LLC;"WINKLEVOSS CAMERON HOWARD;;WINKLEVOSS TYLER HOWARD;;GREEBEL EVAN LOUIS;;MORIARTY KATHLEEN HILL;;XETHALIS GREGORY ELIAS";WINKLEVOSS IP LLC (2015-02-25);Granted Patent;0;6;10;0;G06Q40/04;"G06Q40/04;;G06Q40/00";;137;2
53;US;B1;US 10373129 B1;068-758-163-315-629;2019-08-06;2019;US 201816020534 A;2018-06-27;"US 201816020534 A 20180627;;US 201862660655 P 20180420;;US 201862647353 P 20180323;;US 201862638679 P 20180305;;US 201862689563 P 20180625;;US 201862683412 P 20180611";2018-03-05;System, Method And Program Product For Generating And Utilizing Stable Value Digital Assets;WINKLEVOSS IP LLC;"JAMES DANIEL WILLIAM HALLEY;;ARVANAGHI BRANDON;;PAYA CEM;;WINER ERIC;;WINKLEVOSS CAMERON HOWARD;;WINKLEVOSS TYLER HOWARD";WINKLEVOSS IP LLC (2019-05-30);Granted Patent;0;2;6;0;;"G06Q20/06;;G06Q40/04;;H04L9/00;;H04L9/06;;H04L29/08";;201;2
54;US;A1;US 2020/0098069 A1;101-518-743-722-097;2020-03-26;2020;US 201916698402 A;2019-11-27;"US 201862787206 P 20181231;;US 201862667550 P 20180506;;US 201862751713 P 20181029";2018-05-06;Transaction-enabled Systems And Methods With Licensing Smart Wrappers And Ip Aggregation;STRONG FORCE TX PORTFOLIO 2018 LLC;CELLA CHARLES HOWARD;;Patent Application;0;49;49;0;;"G06Q50/06;;G05B19/418;;G06F9/38;;G06F9/46;;G06F9/50;;G06F16/182;;G06F16/23;;G06F16/27;;G06K9/62;;G06N3/08;;G06N20/00;;G06Q10/04;;G06Q10/06;;G06Q30/02;;G06Q40/04;;G06Q50/18";;0;0
55;US;B1;US 10540654 B1;190-008-382-231-329;2020-01-21;2020;US 201916437841 A;2019-06-11;"US 201916437841 A 20190611;;US 201916293531 A 20190305;;US 201916282955 A 20190222;;US 201916280788 A 20190220;;US 201816036469 A 20180716;;US 201816020534 A 20180627;;US 201815973140 A 20180507;;US 201815973175 A 20180507;;US 201862732347 P 20180917;;US 201862728441 P 20180907;;US 201862721983 P 20180823;;US 201862764977 P 20180817;;US 201862764978 P 20180817;;US 201862702265 P 20180723;;US 201862689563 P 20180625;;US 201862684023 P 20180612;;US 201862683412 P 20180611;;US 201862680775 P 20180605;;US 201862660655 P 20180420;;US 201862647353 P 20180323;;US 201862642931 P 20180314;;US 201862642946 P 20180314;;US 201862638679 P 20180305;;US 201862629417 P 20180212";2018-02-12;System, Method And Program Product For Generating And Utilizing Stable Value Digital Assets;WINKLEVOSS IP LLC;"JAMES DANIEL WILLIAM HALLEY;;ARVANAGHI BRANDON;;PAYA CEM;;WINKLEVOSS CAMERON HOWARD;;WINKLEVOSS TYLER HOWARD;;WINER ERIC NEIMAN;;JUDKINS STEPHEN;;PARKINSON ALEX";WINKLEVOSS IP LLC (2019-10-15);Granted Patent;0;1;6;0;;G06Q20/38;;203;2
56;WO;A2;WO 2019/101239 A2;186-957-029-994-886;2019-05-31;2019;CN 2019078169 W;2019-03-14;CN 2019078169 W 20190314;2019-03-14;Methods And Devices For Acquiring And Recording Tracking Information On Blockchain;ALIBABA GROUP HOLDING LTD;"CHENG LONG;;LI YANPENG";;Patent Application;0;6;6;0;;;;0;0
57;WO;A2;WO 2019/228555 A2;162-293-612-503-511;2019-12-05;2019;CN 2019103730 W;2019-08-30;"CN 2019094396 W 20190702;;CN 2019095299 W 20190709";2019-07-02;System And Method For Blockchain-based Notification;ALIBABA GROUP HOLDING LTD;"YANG RENHUI;;LIU JIAWEI;;CHEN YUAN;;LIN YUQI";;Patent Application;0;3;5;0;;;;0;0
58;WO;A2;WO 2019/072299 A2;014-895-523-430-084;2019-04-18;2019;CN 2018122166 W;2018-12-19;CN 2018122166 W 20181219;2018-12-19;Data Isolation In A Blockchain Network;ALIBABA GROUP HOLDING LTD;WANG JIYUAN;;Patent Application;1;8;8;0;;;;0;0
59;WO;A2;WO 2019/228567 A2;109-691-246-165-664;2019-12-05;2019;CN 2019105431 W;2019-09-11;CN 2019105431 W 20190911;2019-09-11;Shared Blockchain Data Storage Based On Error Correction Coding In Trusted Execution Environments;ALIBABA GROUP HOLDING LTD;ZHUO HAIZHEN;;Patent Application;0;1;1;0;;;;0;0
60;US;B1;US 9892460 B1;189-633-538-720-080;2018-02-13;2018;US 201414318456 A;2014-06-27;"US 201461989047 P 20140506;;US 201461986685 P 20140430;;US 201461978724 P 20140411;;US 201461971981 P 20140328;;US 201461955017 P 20140318;;US 201461933428 P 20140130;;US 201361920534 P 20131224;;US 201361903245 P 20131112;;US 201361900191 P 20131105;;US 201361891294 P 20131015;;US 201361857691 P 20130723;;US 201361857141 P 20130722;;US 201361856323 P 20130719;;US 201361841760 P 20130701;;US 201361841177 P 20130628";2013-06-28;Systems, Methods, And Program Products For Operating Exchange Traded Products Holding Digital Math-based Assets;WINKLEVOSS IP LLC;"WINKLEVOSS CAMERON HOWARD;;WINKLEVOSS TYLER HOWARD;;GREEBEL EVAN LOUIS;;MORIARTY KATHLEEN HILL;;XETHALIS GREGORY ELIAS";WINKLEVOSS IP LLC (2015-02-25);Granted Patent;24;6;10;0;G06Q40/04;G06Q40/04;;133;2
61;WO;A1;WO 2019/223681 A1;152-676-014-042-36X;2019-11-28;2019;CN 2019087783 W;2019-05-21;US 201862675157 P 20180522;2018-05-22;Blockchain-based Transaction Platform With Enhanced Scalability, Testability And Usability;DIGITAL TRANSACTION LTD;HUANG IAN YUAN YUAN;;Patent Application;0;1;1;0;;"H04L29/08;;G06Q40/04";;0;0
